{
  "adapter_id": "top40-v2-declared-score-boundary-v1",
  "candidate_id": "t10-dac-core-v1",
  "capture_boundary": "candidate-declared-post-transform-pre-selection-weight-cap-risk",
  "family_id": "t10-defensive-anchor-convergence-v1",
  "hook": "strategy.score_boundary",
  "label": {
    "executable_price_column": "open",
    "holding_horizon_hours": 24,
    "label_id": "manifest-horizon-simple-executable-open-to-open-return-v1",
    "minimum_pairs": 240,
    "purge_cross_fold_endpoints": true,
    "return_definition": "simple-executable-open-to-open",
    "score_direction": "higher-score-higher-return",
    "statistic_id": "globally-pooled-pearson-v1"
  },
  "schedule_utc": {
    "anchor_timestamp_utc": "1970-01-01T00:00:00Z",
    "interval_hours": 24
  },
  "schema_version": 1,
  "score_description": "Finite built-in dict of the exact final crash-quarantined volume-anchor convergence expected-return score after distance residualization, robust transforms, and confirmation, and before spread filtering, buffered long/short selection, sizing, caps, or organizer risk. A scheduled fail-closed breadth state captures one empty dict. The 24h label matches the only scheduled daily decision and intended holding update.",
  "semantic_coupling_review_sha256": "59b0c7030e0dc0614aa3a84f302fa732cd48101cfd2674f651e509e58bc2e4cf",
  "stage": "development",
  "team_id": "team-10"
}
