{
  "adapter_id": "top40-v2-declared-score-boundary-v1",
  "candidate_id": "t06-balanced-trend-reversal-v1-base",
  "capture_boundary": "candidate-declared-post-transform-pre-selection-weight-cap-risk",
  "family_id": "t06-balanced-trend-reversal-v1",
  "hook": "strategy.score_boundary",
  "label": {
    "executable_price_column": "open",
    "holding_horizon_hours": 24,
    "label_id": "manifest-horizon-simple-executable-open-to-open-return-v1",
    "minimum_pairs": 100,
    "purge_cross_fold_endpoints": true,
    "return_definition": "simple-executable-open-to-open",
    "score_direction": "higher-score-higher-return",
    "statistic_id": "globally-pooled-pearson-v1"
  },
  "schedule_utc": {
    "anchor_timestamp_utc": "2020-02-03T00:00:00Z",
    "interval_hours": 24
  },
  "schema_version": 1,
  "score_description": "Higher post-transform balanced trend/reversal scores rank native crypto tokens for higher expected 24-hour executable open-to-open returns before selection, sizing, caps, and risk controls.",
  "semantic_coupling_review_sha256": "10a8f4729d2559101f68316bdf0bdcac92bf6cd86bd1cd0088fe3f1c6c1ff126",
  "stage": "development",
  "team_id": "team-06"
}
