{
  "adapter_id": "top40-v2-declared-score-boundary-v1",
  "candidate_id": "t08-compressed-shock-recoil-v1-base",
  "capture_boundary": "candidate-declared-post-transform-pre-selection-weight-cap-risk",
  "family_id": "t08-compressed-shock-recoil-v1",
  "hook": "strategy.score_boundary",
  "label": {
    "executable_price_column": "open",
    "holding_horizon_hours": 168,
    "label_id": "manifest-horizon-simple-executable-open-to-open-return-v1",
    "minimum_pairs": 240,
    "purge_cross_fold_endpoints": true,
    "return_definition": "simple-executable-open-to-open",
    "score_direction": "higher-score-higher-return",
    "statistic_id": "globally-pooled-pearson-v1"
  },
  "schedule_utc": {
    "anchor_timestamp_utc": "1970-01-01T00:00:00Z",
    "interval_hours": 168
  },
  "schema_version": 1,
  "score_description": "Higher final scores identify pure-crypto coins expected to outperform after durable negative idiosyncratic three-bar shocks from compressed volatility; lower scores identify the symmetric positive-shock recoil shorts over the exact 168-hour executable open-to-open horizon, before selection, sizing, caps, or risk.",
  "semantic_coupling_review_sha256": "<organizer-fill-canonical-semantic-review-64-hex-sha256>",
  "stage": "development",
  "team_id": "team-08"
}
